<?xml version="1.0" encoding="UTF-8"?>
<paneles xmlns:xsi="http://www.w3.org/2001/XMLSchema-instance" xsi:noNamespaceSchemaLocation="06.xsd">
	<evento tipo="Accidente" fecha="2020-01-01">
		<via>
			<nombre>Autopista del V Centenario</nombre>
			<ref>A-49</ref>
			<origen>Sevilla</origen>
			<destino>Huelva</destino>
			<doble />
			<carriles>1</carriles>
		</via>
		<pk>42.200</pk>
		<retencion long="8.200" />
		<sentido>0</sentido>
		<carrilescortados valor="1" />
	</evento>
	<evento tipo="Retención" fecha="2020-12-02">
		<via>
			<nombre>Autovía de Andalucía</nombre>
			<ref>A-4</ref>
			<origen>Madrid</origen>
			<destino>Cádiz</destino>
			<doble />
			<carriles>4</carriles>
		</via>
		<pk>550.000</pk>
		<retencion long="3.000" />
		<sentido>-1</sentido>
	</evento>
</paneles>